{
  "source_video": {
    "video_id": "video-sample_training_video",
    "file_name": "sample_training_video.mp4",
    "file_path": "samples\\sample_training_video.mp4",
    "source_type": "local_file",
    "duration_ms": 0,
    "language": "ja",
    "checksum": null
  },
  "transcript_segments": [
    {
      "segment_id": "ts-001",
      "start_ms": 0,
      "end_ms": 5000,
      "text": "これはダミーの文字起こしです。",
      "speaker_id": "spk-001",
      "confidence": 0.95
    },
    {
      "segment_id": "ts-002",
      "start_ms": 5000,
      "end_ms": 10000,
      "text": "実装の確認用データです。",
      "speaker_id": "spk-001",
      "confidence": 0.94
    },
    {
      "segment_id": "ts-003",
      "start_ms": 10000,
      "end_ms": 15000,
      "text": "実際の処理は後で統合予定です。",
      "speaker_id": "spk-001",
      "confidence": 0.93
    }
  ],
  "ocr_segments": [
    {
      "ocr_id": "ocr-001",
      "start_ms": 2000,
      "end_ms": 5000,
      "text": "メニュー画面",
      "bbox": [
        100,
        50,
        300,
        100
      ],
      "confidence": 0.92
    },
    {
      "ocr_id": "ocr-002",
      "start_ms": 8000,
      "end_ms": 12000,
      "text": "確認ボタン",
      "bbox": [
        400,
        400,
        600,
        450
      ],
      "confidence": 0.91
    }
  ],
  "screenshot_candidates": [],
  "speaker_segments": [],
  "evidence_links": []
}